[
    {
        "required_str": "alpha",
        "required_int": 10,
        "required_nullable_str": "present",
        "required_anyof_nullable": 99,
        "required_enum_nullable": "high",
        "optional_str": "opt_value",
        "optional_with_default": "explicit",
        "optional_nullable_number": 1.25,
        "strict_int_list": [
            1,
            2,
            3
        ],
        "nullable_int_list": [
            10,
            null,
            30
        ],
        "optional_str_list": [
            "a",
            "b"
        ]
    },
    {
        "required_str": "beta",
        "required_int": 0,
        "required_nullable_str": null,
        "required_anyof_nullable": null,
        "required_enum_nullable": null,
        "optional_nullable_number": null,
        "strict_int_list": [],
        "nullable_int_list": [
            null
        ]
    }
]

